"An das","(المرسل اليه)."
"Das Gericht kann Sie auch auffordern, fehlende Belege nachzureichen und Ihre Angaben an Eides statt zu versichern. Wenn Sie angeforderte Belege nicht nachreichen, kann dies dazu führen, dass Ihr Antrag auf Bewilligung von Beratungshilfe zurückgewiesen wird. Bei bewusst falschen oder unvollständigen Angaben droht Ihnen außerdem strafrechtliche Verfolgung.","تستطيع المحكمة ان تطالبك بإرسال الأوراق الناقصة وايضاً الحلفان بالقَسم على معلوماتك. في حالة عدم ارسال باقي الأوراق المطلوبة يمكن للمحكمة رفض طلبك لهذا السبب. في حالة الحصول على معلومات غير صحيحة او غير مكتملة (عمداً) الملاحقة قانونياً ممكنة."
"Mit diesem Formular können Sie beim zuständigen Amtsgericht einen Antrag auf Beratungshilfe stellen. Wird dem Antrag stattgegeben, zahlt das Gericht eine Beratung durch eine Rechtsanwältin/einen Rechtsanwalt (Erstberatung).","بهذه الاستمارة لديك الامكانية ان تقدّم طلبا في المحكمة الرسمية لمساعدة استشارية. في حالة الموافقة على الطلب ستدفع المحكمة لك تكاليف استشارة المحامي(ة) القانونية."
"Sie können den Antrag per Post ans Amtsgericht schicken oder ihn persönlich beim Amtsgericht stellen.","بامكانك ان ترسل الاستمارة الى المحكمة بالبريد او ان توصلها شخصيا."
"Folgende Unterlagen sind in Kopie mitzusenden (Antrag Postweg), bzw. im Original mitzubringen (persönlicher Antrag vor Ort):","يجب عليك ارفاق الوثائق التالية كنسخة مصورة (بريديا) او احضارها نسخة أصلية (شخصيا):"
"- Personalausweis oder Reisepass mit polizeilicher Anmeldebescheinigung","ـ هوية او جواز سفر مع تسجيل محل اقامته."
"- Einkommensnachweise (z.B. Verdienstbescheinigungen, Alg II-Bescheid etc.)","ـ إثبات الدخل (مثلا قسيمة الراتب او قسيمة اعانة البطالة)"
"- Mietvertrag","ـ عقد الإيجار"
"- Kontoauszüge der letzten drei Monate","ـ كشف الحسابات البنكية من الشهور الثلاث الماضية"
"- Nachweise über laufende Zahlungsverpflichtungen und besondere Belastungen","ـ إثبات الديون الحالية و أعباء خاصة."
"- Unterlagen zu Ihrem rechtlichen Problem (z.B. Schreiben vom und an den Gegner)","ـ المستندات القانونية الخاصة (مثلا رسائل من الخصم او رسائل الى الخصم)."
"Siehe auch das Merkblatt zur Beratungshilfe: http://service.berlin.de/dienstleistung/326037/pdf/","بإمكانكَ أيضاً الإطلاع على ورقة التعليمات التالية للمساعدة الاستشارية (أنظر الرابط) http://service.berlin.de/dienstleistung/326037/pdf/"
