"Kindergeld-Nr.","Child benefit number"
"Steuerliche Identifikationsnummer der antragstellenden Person (zwingend ausfüllen)","Tax ID of the applicant (required)"
"Familienkasse","Family Benefits Office"
"Beachten Sie bitte die anhängenden Hinweise und das Merkblatt Kindergeld.","Please pay attention to the attached information and the Child Benefit Fact Sheet (Merkblatt Kindergeld)"
"Telefonische Rückfrage tagsüber unter Nr.:","Telephone number during the day in case of questions:"
"Antrag auf Kindergeld","Application for child benefit"
"Bitte fügen Sie für jedes Kind, für das Kindergeld beantragt wird, eine „Anlage Kind“ bei.","please attatch an ""Anlage Kind"" (Appendix Child) form for each child for whom your are applying for child benifit"
"Anzahl der beigefügten ""Anlage Kind"":","Number of attached enclosures ""Anlage Kind"""
"Angaben zur antragstellenden Person","Information on the applicant"
"Name","Surname"
"Titel","Title"
"Vorname","First name"
"ggf. Geburtsname und Name aus früherer Ehe","birth name and name from previous marriage, if applicable"
"Geburtsdatum","Date of birth"
"Geburtsort","Place of birth"
"Geschlecht","Gender"
"Staatsangehörigkeit (wenn nicht EU-/EWR-Staat oder Schweiz, bitte Aufenthaltstitel beifügen!)","Nationality (in case of nationality outside of EU/EEA or Switzerland, please provide residence title)"
"Anschrift (Straße/Platz, Hausnummer, Postleitzahl, Wohnort, Staat)","Address (street/place, house number, postcode, city, country)"
"Familienstand","Marital status"
"ledig","single"
"seit","since"
"verheiratet","married"
"verwitwet","widowed"
"in eingetragener Lebenspartnerschaft lebend","living in registered civil partnership"
"geschieden","divorced"
"dauernd getrennt lebend","permanently separated"
"Angaben zum/zur Ehegatten/Ehegattin bzw. eingetragenen Lebenspartner(in)","Information on the applicant's spouse"
"Staatsangehörigkeit","Nationality"
"Anschrift, wenn abweichend von antragstellender Person (Straße/Platz, Hausnummer, Postleitzahl, Wohnort, Staat)","Address, if different from the applicant's address (street/place, street number, postcode, city, country)"
"Angaben zum Zahlungsweg","Information on the method of payment"
"IBAN","IBAN"
"BIC","BIC"
"Bank, Finanzinstitut (ggf. auch Zweigstelle)","Bank, Financial institution (where appropriate the branch)"
"Kontoinhaber(in) ist","The account holder is"
"antragstellende Person wie unter 1","the applicant as in 1"
"nicht antragstellende Person, sondern:","not the applicant but:"
"Name, Vorname","Surname, name"
"Der Bescheid soll nicht mir, sondern folgender Person zugesandt werden:","The notification is not to be sent to me, but to the following person:"
"Angaben zu Kindern","Information on the children"
"Für jedes Kind, für das Kindergeld neu beantragt wird, ist eine gesonderte „Anlage Kind“ ausgefüllt einzureichen.","For each child, for whom you claim child benifit, fill in and submit a separate ""Anlage Kind""."
"Für folgende Kinder beziehe ich bereits Kindergeld","I already get child benifit for the following children:"
"Vorname des Kindes ggf. abweichender Familienname","Child's first name and, if different from yours, surname"
"Bei welcher Familienkasse (Kindergeldnummer, Personalnummer)?","From which Familienkasse (Family Benefits Center) (child benefit-Number, Personal-number)?"
"Folgende Zählkinder sollen berücksichtigt werden:","The following counted children are to be taken into consideration:"
"Wer bezieht das Kindergeld (Name, Vorname)?","Who receives the child benefit (surname, name)?"
"Ich versichere, dass alle Angaben (auch in den Anlagen) vollständig sind und der Wahrheit entsprechen. Mir ist bekannt, dass ich alle Änderungen, die für den Anspruch auf Kindergeld von Bedeutung sind, unverzüglich der Familienkasse mitzuteilen habe. Den Inhalt des Merkblattes Kindergeld (zu finden unter www.bzst.de oder www.familienkasse.de) habe ich zur Kenntnis genommen.","I hereby declare that all the information was provided truthfully (in the annexes as well). I am aware that any change in the given information has to be reported to the Family Benefits Office immediately. I received the Child Benefit Fact Sheet (can be found at www.bzst.de or www.familienkasse.de) and took notice of its content."
"Datum","Date"
"Ich bin damit einverstanden, dass das Kindergeld zugunsten der antragstellenden Person festgesetzt bzw. bewilligt wird.","I agree that the child benefit will be paid to the applicant."
"(Unterschrift der antragstellenden Person bzw. der gesetzlichen Vertretung)","Signiture of the applicant or, if appropriate, the legal representative"
"Hinweis zum Datenschutz: Die Daten werden aufgrund und zum Zweck der §§ 31, 62 bis 78 Einkommensteuergesetz und der Regelungen der Abgabenordnung bzw. aufgrund des Bundeskindergeldgesetzes und des Sozialgesetzbuches erhoben, verarbeitet und genutzt.","Information according to Bundesdatenschutzgeset (the German Data Protection Act): The data is collected, processed and used due to and for the purpose of §§ 31, 62 to 78 Einkommenssteuergesetz (Income Tax Act) and regulations of Abgabenordnung (General Tax Code) and the Bundeskindergeldgesetz (Federal Child Benefit Act) and the Sozialgesetzbuch (Code of Social Law)."
"Alle Eingaben löschen","Delete all entries"
"Drucken","Print"
"Speichern","Save"
"Nur von der Familienkasse auszufüllen","To be filled in by the Familienkasse (Family Benefits Office)"
"Hinweise zum Antrag auf Kindergeld und zur Anlage Kind","Information for the application for child benefit and for ""Anlage Kind"" (Appendix Child)"
"Füllen Sie bitte den Antragsvordruck und die Anlage Kind sorgfältig und gut leserlich aus und kreuzen Sie das Zutreffende an. Vergessen Sie Ihre *Unterschrift* nicht! Sofern Sie minderjährig sind, muss Ihr gesetzlicher Vertreter für Sie unterschreiben.","Please complete the application form as well as the Annex ""Child"" (Anlage Kind) legibly and check where applicable. Do not forget your *signature*! If you are under age, a legal representative has to sign for you."
"Lassen Sie den Antrag *auch* von dem mit Ihnen gemeinsam in einem Haushalt lebenden Ehegatten bzw. Lebenspartner/anderen Elternteil unterschreiben, wenn er damit einverstanden ist, dass Sie das Kindergeld erhalten. Wenn kein Einvernehmen besteht, teilen Sie dies bitte der Familienkasse mit. Wurde der Berechtigte gerichtlich bestimmt, fügen Sie bitte den Beschluss bei.","Have your spouse / life partner / the other parent sign the application *as well*, if he/she agrees to your receiving the child benefit. If there is no consensus, please inform the Family Benefits Office about it. If the beneficiary was determined in court, please submit the court decision."
"Bitte beachten Sie, dass Ihr Antrag nur bearbeitet werden kann, wenn er *vollständig ausgefüllt* wurde.","Please note that your application can only be processed if *fully completed*."
"Rechtslage ab 2018","Legal Situation starting in 2018"
"Zu 1 und 2: Angaben zur antragstellenden Person und zum/zur Ehegatten/Ehegattin bzw. Lebenspartner(in)","For 1 and 2: Information on the applicant and the spouse / life partner"
"Wenn beide Elternteile eines Kindes die Voraussetzungen für den Anspruch auf Kindergeld erfüllen, ist als antragstellende Person der Elternteil einzutragen, der nach dem Willen beider Elternteile das Kindergeld erhalten soll. Beim Familienstand ist nur dann „dauernd getrennt lebend“ anzukreuzen, wenn bei Ehepaaren mindestens ein Ehepartner die Absicht hat, die Trennung ständig aufrechtzuerhalten. Sofern Sie nicht verheiratet sind oder Ihr/Ihre Ehegatte/Ehegattin bzw. Lebenspartner(in) nicht zugleich der andere leibliche Elternteil mindestens eines der in der/den „Anlage/n Kind“ aufgeführten Kinder ist, teilen Sie die Angaben zum anderen leiblichen Elternteil (bei Pflege- oder Enkelkindern zu beiden leiblichen Elternteilen) bitte auf der jeweiligen „Anlage Kind“ mit.","If both parents of a child qualify for child benefit, the parent agreed upon by both parents should be named as applicant. You should only tick ""permanently separated"" under ""Family status"", if at least one spouse intends to stay separated constantly. If you are not married, or your spouse/life partner is not the biological parent of at least one of the children listed in the attached form(s) ""Anlage Kind"", please enter the information for the other biological parent (or for both biological parents in case of foster children or grandchildren) in the relevant ""Anlage Kind""."
"Sollten Sie eine **andere** als die deutsche Staatsangehörigkeit oder als die Staatsangehörigkeit eines EU-/EWR-Staates bzw. der Schweiz besitzen, fügen Sie bitte **den Aufenthaltstitel** bei.","If you are **not** a citizen of Germany, a state of the EU/EEA or Switzerland, please attach your **residence title** (e.g. passport copy)."
"Zu 4: Der Bescheid soll nicht mir, sondern folgender Person zugesandt werden","To 4: The notification should not be sent to me, but to the following person"
"Hier können Sie einen/eine Empfangsbevollmächtigten/Empfangsbevollmächtigte (z. B. Steuerberater, Lohnsteuerhilfeverein etc.) angeben, welcher den Bescheid über Kindergeld erhalten soll.","You can provide the name of an authorised person (for example, tax advisor, tax assistance association, etc) here, who should recieve your child benifit notification."
"Zu 6: Folgende Zählkinder sollen berücksichtigt werden","Ad 6: The following counted children are to be taken into consideration"
"Kinder, für die eine andere Person Kindergeld erhält, können sich bei Ihnen kindergelderhöhend auswirken (Zählkinder). Sofern Sie die Berücksichtigung von Zählkindern geltend machen wollen, geben Sie bitte in jedem Fall an, wer für die Zählkinder das Kindergeld bei welcher Familienkasse bezieht.","Children, for whom another person receives child benefit, could have an increasing effect on your child benefit (counted children). If you want to consider counted children, please provide information in any case, who is receiving the child benefit for the counted children from which Family benefit office."
"Anlage Kind","Appendix Child"
"Allgemeines","General information"
"Bitte füllen Sie die „Anlage Kind“ vollständig aus. Beim Antrag aufgrund der Geburt eines Kindes ist eine Kopie der Geburtsbescheinigung für Kindergeld oder der Geburtsurkunde erforderlich und ausreichend, wenn keine Zweifel bestehen, dass das Kind in den Haushalt der Eltern aufgenommen ist. Bei einem im Ausland geborenen Kind ist als Nachweis die Geburtsurkunde ausreichend. Für über 18 Jahre alte Kinder ist die Anlage nur auszufüllen, wenn sie eine der im Merkblatt Kindergeld genannten besonderen Voraussetzungen erfüllen. Entsprechende Nachweise (z. B. über die Schul- oder Berufsausbildung) sind beizufügen. Bei angenommenen (adoptierten) Kindern bitte den Annahmebeschluss des Familiengerichts beifügen.","Please fully complete the form ""Anlage Kind"". For a first application for child benefit after birth, enclosing the original ""Geburtsbescheinigung für Kindergeld"" (birth certificate for child benefit) or birth certificate is both required and sufficient if there is no doubt about the fact that the child will join the parent's household. For a child born abroad, the birth certificate is sufficient proof. For children over the age of 18, you must only complete ""Anlage Kind"" if the child fulfils one of the special requirements stated in the Child Benefit Fact Sheet. Relevant supporting documents (e.g. for school or vocational training) must be attached. For adopted children, a notice of acceptance must be attached."
"„Andere Personen“, zu denen ein Kindschaftsverhältnis besteht, sind: Eltern, Stiefeltern, Adoptiveltern, Pflegeeltern, Großeltern.","""Other persons"" to whom the child has a parent/child relationship are: parents, stepparents, adoptive parents, foster parents, grandparents."
"Zu 1: Angaben zum Kind","Ad 1: Information about the child"
"Wenn Kinder außerhalb Ihres Haushalts leben, geben Sie den Grund an (z. B. Unterbringung bei Großeltern, in einer Pflegestelle/einem Heim, wegen Schul- oder Berufsausbildung).","If children are living outside your household, name the reason for it (e.g. accommodations at grandparents/foster care/home because of schooling/professional education.)"
"Zu 2: Kindschaftsverhältnis zur antragstellenden Person, zum/zur Ehegatten/Ehegattin bzw. Lebenspartner(in) und zu anderen Personen","Ad 2: Relationship of child to applicant, to spouse or to life partner and other persons"
"Die Eintragung der hier abgefragten Angaben ist **in jedem Fall** erforderlich. Wenn der andere Elternteil / die Eltern des Kindes verstorben sind, ist dies durch den Zusatz „verstorben“ anzugeben. Ist für ein Kind die Vaterschaft nicht rechtswirksam festgestellt worden, ist „unbekannt“ bzw. „Vaterschaft nicht festgestellt“ einzutragen.","The entry of the data requested here is mandatory **in any case**. If the other parent/the parents of the child are deceased, it has to be stated with the addendum ""deceased."". If paternity for a child hasn't been legally determined, ""unbekannt“ (""unknown"") or „Vaterschaft nicht festgestellt"" (""paternity not determined"") has to be stated."
"Zu 3: Angaben für ein volljähriges Kind","Ad 3:Information for a child of legal age"
"Besondere Anspruchsvoraussetzungen","Special eligibility criteria"
"Die Berücksichtigung eines volljährigen Kindes ist möglich, wenn es","The consideration of a child of legal age is possible if it"
"1. noch nicht das 21. Lebensjahr vollendet hat, nicht in einem Beschäftigungsverhältnis steht und bei einer Agentur für Arbeit im Inland als Arbeitsuchender gemeldet ist oder","1. hasn't reached 21 years of age, is not gainfully employed and is registered as a job-seeker at an Employment Agency in Germany, or"
"2. noch nicht das 25. Lebensjahr vollendet hat und","2. hasn't reached the age of 25 and"
"a) für einen Beruf ausgebildet wird oder","a) is in a job training or"
"b) sich in einer Übergangszeit von höchstens vier Monaten befindet oder","b) is in a transition period of no more than 4 months, or"
"c) eine Berufsausbildung mangels Ausbildungsplatzes nicht beginnen oder fortsetzen kann oder","c) can't start or continue professional training due to lack of an apprenticeship, or"
"d) einen geregelten Freiwilligendienst leistet oder","d) performs regulated voluntary service, or"
"3. wegen körperlicher, geistiger oder seelischer Behinderung außerstande ist, sich selbst zu unterhalten; Voraussetzung ist, dass die Behinderung vor Vollendung des 25. Lebensjahres eingetreten ist (ohne Altersgrenze).","3. is not able to sustain itself due to a physical, mental, or phsychological handicap: To qualify it, the handicap must have occured before the child turned 25 years of age (without age limit)."
"Nach Abschluss einer erstmaligen Berufsausbildung oder eines Erststudiums wird ein Kind in den Fällen der Nummer 2 (a bis d) nur berücksichtigt, wenn das Kind keiner (schädlichen) Erwerbstätigkeit nachgeht.","After completion of an initial apprenticeship or a first degree a child in the cases of number 2 (a to d) is only considered if the child doesn't pursue a (detrimental) employment."
"Eine Ausbildung (Berufsausbildung oder Studium) ist grundsätzlich abgeschlossen, wenn sie zur Ausübung eines Berufs befähigt, auch wenn das Kind später eine weitere Ausbildung aufnimmt. Wurde jedoch das angestrebte Berufsziel mit dem erworbenen Abschluss noch nicht erreicht, kann auch eine weiterführende Ausbildung noch Teil der Erstausbildung sein, wenn die Ausbildungsabschnitte in einem engen sachlichen Zusammenhang zueinander stehen und in engem zeitlichen Zusammenhang durchgeführt werden.","An education (vocational or university) is completed, if it serves as a professional qualification, even if followed by further education. If this is not the case, further training may still count as part of the primary education if the steps are closly related and happen without major breaks."
"Ein Kind ist erwerbstätig, wenn es einer auf die Erzielung von Einkünften gerichteten Beschäftigung nachgeht, die den Einsatz seiner persönlichen Arbeitskraft erfordert. Hieraus folgt, dass der Begriff „Erwerbstätigkeit“ durch eine nichtselbständige Tätigkeit, eine land- und forstwirtschaftliche, eine gewerbliche und eine selbständige Tätigkeit erfüllt werden kann. Die Verwaltung eigenen Vermögens ist demgegenüber keine Erwerbstätigkeit.","A child is gainfully employed, if it pursues an occupation aimed at generating income, that requires its personal manpover. Consequently the term ""gainful employment"" can be fulfilled by a dependent activity, agricultural and forestry activities, and business and self-employed activities. In comparison, the management of one's own assets is not gainful employment."
"Bitte weisen Sie die wöchentliche Arbeitszeit anhand geeigneter Unterlagen (z.B. Arbeitsvertrag / Bescheinigung des Arbeitgebers) nach. Wurde von den vertraglich vereinbarten Arbeitszeiten abgewichen, kann ein Nachweis hierfür durch Vorlage von Gehaltsabrechnungen, einem Auszug aus dem Arbeitskonto oder einer Arbeitgeberbescheinigung erfolgen. Fehlzeiten aufgrund von Urlaub, Krankheit oder ähnliches mindern die vertraglich vereinbarte Arbeitszeit nicht.","Please proove the weekly working hours with appropriate documents (e.g. employment contract/certificate of employment from your employer). Deviations from the working hours in the contract can be prooved by submission of payslips, a statement of the work account, or an employer statement. Absence due to vacation, sickness or the like doesn't reduce the contractual agreed-upon working hours."
"Zu 5: Anspruch auf eine Geldleistung von einer Stelle außerhalb Deutschlands / von einer zwischen- oder überstaatlichen Stelle","Ad 5: Claim a payment from an authority outside Germany/ from a cross-national or supranational authority"
"Hier sind beispielsweise Ansprüche auf kindbezogene Familienleistungen, die im Ausland bestehen oder Ansprüche auf kindbezogene Leistungen von einer Beschäftigungsbehörde (z. B. der Europäischen Union) einzutragen.","Here you have to fill in, for example, claims of child-related family benefits that you get from abroad, or child-related benefits from an employment authority (e.g. the European Union)."
"Zu 6: Sind oder waren Sie oder eine andere Person, zu der das Kind in einem Kindschaftsverhältnis steht, in den letzten 5 Jahren vor der Antragstellung: (...)","Ad 6: Do/Did you or another person related to the child during the last five years prior to the application: (...)"
"„Tätigkeit im öffentlichen Dienst“ bedeutet eine Tätigkeit als Beamter/Versorgungsempfänger/(Tarif-)Beschäftigte des Bundes, eines Landes, einer Gemeinde, eines Gemeindeverbandes oder einer sonstigen Körperschaft, Anstalt oder Stiftung des öffentlichen Rechts oder als Richter, Berufssoldat oder Soldat auf Zeit.","""Tätigkeit im öffentlichen Dienst"" means an occupation as a civil servant/pension recipient /federal, state or municipal employy, employee of local authoities, or employee of another body, institution or foundation under the public law, or as a judge, professional soldier, or a regular soldier."
"Hierzu zählt auch die bei einem privaten Arbeitgeber ausgeübte Tätigkeit, soweit Angehörige des öffentlichen Dienstes hierfür beurlaubt worden sind. Nicht zum öffentlichen Dienst zählen Religionsgemeinschaften des öffentlichen Rechts (Kirchen einschl. der Ordensgemeinschaften, kirchlichen Krankenhäuser, Schulen, Kindergärten und ähnliches) sowie die Spitzen-/Mitgliedsverbände der freien Wohlfahrtspflege und die ihnen angeschlossenen Einrichtungen.","This also includes the work for a private employer, as far as public service employees are on leave. Religious communities under the public law (churches including religious orders, church hospitals, schools, and kindergartens and the like) as well as umbrella-/member associations of statutory welfare and bodies associated with them, are not considered as a part of public service."
"Die Fragen 6b bzw. 6c sind auch dann mit „ja“ zu beantworten, wenn Sie, Ihr Ehegatte bzw. Lebenspartner oder eine andere Person, zu der eines der Kinder in einem Kindschaftsverhältnis steht, im diplomatischen oder konsularischen Dienst tätig sind oder waren.","You must answer questions 6b and 6c with 'yes' if you, your spouse or life partner or another person related to one the children, work or worked for diplomatic or consular services."
"Ausführliche Informationen zum Kindergeld finden Sie im Internet unter www.bzst.de bzw. unter www.familienkasse.de.","You can find detailed information about child benefit on the internet at www.bzst.de bzw. and www.familienkasse.de."
