"Hierzu zählt auch die bei einem privaten Arbeitgeber ausgeübte Tätigkeit, soweit Angehörige des öffentlichen Dienstes hierfür beurlaubt worden sind. Nicht zum öffentlichen Dienst zählen Religionsgemeinschaften des öffentlichen Rechts (Kirchen einschl. der Ordensgemeinschaften, kirchliche Krankenhäuser, Schulen, Kindergärten und ähnliches) sowie die Spitzen-/Mitgliedsverbände der freien Wohlfahrtspflege und die ihnen angeschlossenen Einrichtungen.","También cuenta la actividad ejercida para un empleador privado, siempre que para ello hayan obtenido la excedencia miembros de la administración pública. No pertenecen a la administración pública las comunidades religiosas del derecho público (iglesias incluidas las congregaciones religiosas, los hospitales, colegios, guarderías eclesiásticos y similares) así como las organizaciones centrales y asociaciones miembro de organismos de carácter benéfico y las instituciones asociadas."
"Zu 6: Anspruch auf eine Geldleistung von einer Stelle außerhalb Deutschlands / von einer zwischen- oder überstaatlichen Stelle","Acerca de 6: Derecho a pagos de una entidad no alemana o de una institución intergubernamental o supranacional"
"Hier sind beispielsweise Ansprüche auf kindbezogene Familienleistungen, die im Ausland bestehen oder Ansprüche auf kindbezogene Leistungen von einer Beschäftigungsbehörde (z. B. der Europäischen Union) einzutragen.","Aquí deberán indicarse, por ejemplo, los derechos a asignaciones familiares por hijos, existentes en el extranjero, o derechos a asignaciones relacionadas con los hijos de un organismo de empleo (p. ej. de la Unión Europea)."
"Zu 7: Sind oder waren Sie oder eine andere Person, zu der das Kind in einem Kindschaftsverhältnis steht, in den letzten 5 Jahren vor der Antragstellung: (…)","Acerca de 7: Ha trabajado Ud. o otra persona con relación con el hijo en los últimos cinco años antes de la solicitud"
"Die Fragen 7a bzw. 7b sind auch dann mit „ja“ zu beantworten, wenn Sie, Ihr(e) Ehepartner(in) bzw. eingetragene(r) Lebenspartner(in) oder eine andere Person, zu der eines der Kinder in einem Kindschaftsverhältnis steht, im diplomatischen oder konsularischen Dienst tätig sind oder waren.","Las preguntas 7b y 7c también se responden con ""sí"", si Ud., su cónyuge o su pareja de la unión civil, u otra persona que tenga una relación con uno de los hijos/as, trabajó al servicio de misiones diplomáticas o de oficinas consulares."
"Ausführliche Informationen zum Kindergeld finden Sie im Internet unter www.bzst.de bzw. unter www.familienkasse.de.","Informaciones detalladas sobre el subsidio familiar por hijos se pueden encontrar en internet en las páginas www.bzst.de y www.familienkasse.de."
